{
  "title": "The Feedback Decision",
  "situation": {
    "description": "You're a team lead and just reviewed work from a team member. The deliverable has some significant issues that need to be addressed, but the person worked hard on it and seems proud of their effort.",
    "context": "This is a relatively new team member who you want to develop. They've shown potential but still have skill gaps.",
    "highlights": ["significant issues", "worked hard", "proud of their effort", "new team member", "skill gaps"]
  },
  "variables": [
    {
      "id": "timing",
      "label": "When do you give feedback?",
      "description": "Choose when to deliver the feedback",
      "type": "select",
      "options": [
        { "value": "immediate", "label": "Immediately - address it now" },
        { "value": "scheduled", "label": "Schedule a 1:1 meeting" },
        { "value": "delay", "label": "Wait for a better moment" }
      ],
      "default": "scheduled"
    },
    {
      "id": "approach",
      "label": "How do you frame it?",
      "description": "Choose your feedback approach",
      "type": "select",
      "options": [
        { "value": "direct", "label": "Direct and specific about issues" },
        { "value": "sandwich", "label": "Positive-negative-positive sandwich" },
        { "value": "questions", "label": "Ask questions to guide self-discovery" }
      ],
      "default": "direct"
    },
    {
      "id": "focus",
      "label": "What's your main focus?",
      "description": "Choose what to emphasize",
      "type": "toggle",
      "options": [
        { "value": "task", "label": "The task/deliverable" },
        { "value": "growth", "label": "Their development" }
      ],
      "default": "growth"
    }
  ],
  "outcomes": [
    {
      "condition": { "timing": "immediate", "approach": "direct", "focus": "task" },
      "result": {
        "title": "Quick Fix, Potential Damage",
        "description": "The issues get addressed quickly, but the team member feels caught off-guard and defensive.",
        "consequences": [
          "Issues are corrected promptly",
          "Team member feels embarrassed in front of others",
          "They may become hesitant to share work early in the future",
          "Trust may be slightly damaged"
        ],
        "insight": "Immediate, direct, task-focused feedback is efficient but can feel harsh. It works best when there's already high trust and psychological safety.",
        "tone": "warning"
      }
    },
    {
      "condition": { "timing": "scheduled", "approach": "questions", "focus": "growth" },
      "result": {
        "title": "Development-Focused Conversation",
        "description": "The meeting becomes a coaching conversation where the team member discovers the issues themselves.",
        "consequences": [
          "Takes more time than a quick correction",
          "Team member develops critical thinking skills",
          "They feel respected and invested in",
          "Learning is more likely to transfer to future work",
          "Builds trust and psychological safety"
        ],
        "insight": "This approach is ideal for developing team members. The time investment pays off in long-term capability building and engagement.",
        "tone": "positive"
      }
    },
    {
      "condition": { "timing": "delay", "approach": "sandwich", "focus": "task" },
      "result": {
        "title": "Mixed Signals",
        "description": "The delayed feedback feels disconnected from the work, and the sandwich approach obscures the key message.",
        "consequences": [
          "Team member may not fully understand the issues",
          "The 'sandwich' can feel inauthentic",
          "Issues may persist or recur",
          "Opportunity for timely learning is lost"
        ],
        "insight": "Delayed feedback with softened delivery can seem kind but often fails to drive improvement. Be timely and clear, while still being respectful.",
        "tone": "negative"
      }
    }
  ],
  "defaultOutcome": {
    "title": "A Reasonable Approach",
    "description": "Your combination of choices represents a thoughtful approach to giving feedback.",
    "consequences": [
      "Consider how timing affects receptiveness",
      "Think about whether the person needs direction or discovery",
      "Balance the immediate task needs with long-term development"
    ],
    "insight": "There's rarely one 'right' way to give feedback. The best approach depends on the person, the context, and the relationship.",
    "tone": "neutral"
  }
}
